{
  "$schema":"https://json-schema.org/draft/2020-12/schema","$id":"https://cloverapps.ai/schemas/launch-studio/0.1.0/build-charter.schema.json","title":"Hash-bound Build Charter","type":"object","additionalProperties":false,
  "required":["documentType","schemaVersion","recordId","sessionId","exactTarget","intendedUsers","intendedFruit","sourceAnchor","rollbackAnchor","scope","nonGoals","allowedPaths","prohibitedPaths","prohibitedEffects","deliverables","testPlan","visualBrowserPlan","privacyClass","budgetId","repairLoopLimit","progressReportingContract","stopConditions","contextPackHash","impactScanHash","acceptanceContractHash","charterApprovalAuthorityReferenceId","approvalDoesNotAuthorizeMergeOrProduction","recordHash","synthetic","consequentialAuthorityGranted"],
  "properties":{"documentType":{"const":"clover-build-charter"},"schemaVersion":{"const":"0.1.0"},"recordId":{"$ref":"common.schema.json#/$defs/id"},"sessionId":{"$ref":"common.schema.json#/$defs/id"},"exactTarget":{"type":"string","minLength":1},"intendedUsers":{"$ref":"common.schema.json#/$defs/stringArray"},"intendedFruit":{"$ref":"common.schema.json#/$defs/stringArray"},"sourceAnchor":{"type":"string","pattern":"^[A-Za-z0-9](?:[A-Za-z0-9-]*[A-Za-z0-9])?/[A-Za-z0-9](?:[A-Za-z0-9._-]*[A-Za-z0-9])?@[a-f0-9]{40}$"},"rollbackAnchor":{"type":"string","minLength":1},"scope":{"$ref":"common.schema.json#/$defs/stringArray"},"nonGoals":{"$ref":"common.schema.json#/$defs/stringArray"},"allowedPaths":{"$ref":"common.schema.json#/$defs/stringArray"},"prohibitedPaths":{"$ref":"common.schema.json#/$defs/stringArray"},"prohibitedEffects":{"$ref":"common.schema.json#/$defs/stringArray"},"deliverables":{"$ref":"common.schema.json#/$defs/stringArray"},"testPlan":{"$ref":"common.schema.json#/$defs/stringArray"},"visualBrowserPlan":{"$ref":"common.schema.json#/$defs/stringArray"},"privacyClass":{"$ref":"common.schema.json#/$defs/privacyClass"},"budgetId":{"$ref":"common.schema.json#/$defs/id"},"repairLoopLimit":{"type":"integer","minimum":0},"progressReportingContract":{"$ref":"common.schema.json#/$defs/stringArray"},"stopConditions":{"$ref":"common.schema.json#/$defs/stringArray"},"contextPackHash":{"$ref":"common.schema.json#/$defs/hash"},"impactScanHash":{"$ref":"common.schema.json#/$defs/hash"},"acceptanceContractHash":{"$ref":"common.schema.json#/$defs/hash"},"charterApprovalAuthorityReferenceId":{"$ref":"common.schema.json#/$defs/id"},"approvalDoesNotAuthorizeMergeOrProduction":{"const":true},"recordHash":{"$ref":"common.schema.json#/$defs/hash"},"synthetic":{"type":"boolean"},"consequentialAuthorityGranted":{"const":false}}
}
