{"acceptanceContractHash":"f34b2457c4c325c57c4a859881d4a4abaa1bd54ca29f47946c5c663362a10042","allowedPaths":["apps/clover-launch-studio/package.json","apps/clover-launch-studio/package-lock.json","apps/clover-launch-studio/tsconfig.json","apps/clover-launch-studio/next.config.mjs","apps/clover-launch-studio/src/app/layout.tsx","apps/clover-launch-studio/src/app/page.tsx","apps/clover-launch-studio/src/app/globals.css","apps/clover-launch-studio/src/app/api/health/route.ts","apps/clover-launch-studio/src/middleware.ts","apps/clover-launch-studio/src/app/sign-in/[[...sign-in]]/page.tsx","apps/clover-launch-studio/src/app/access-denied/page.tsx","apps/clover-launch-studio/src/app/api/sessions/route.ts","apps/clover-launch-studio/src/app/api/sessions/[sessionId]/route.ts","apps/clover-launch-studio/src/app/api/sessions/[sessionId]/events/route.ts","apps/clover-launch-studio/src/app/api/sessions/[sessionId]/export/route.ts","apps/clover-launch-studio/src/app/api/sessions/[sessionId]/restore/route.ts","apps/clover-launch-studio/src/app/api/sessions/[sessionId]/handoff/route.ts","apps/clover-launch-studio/src/components/launch-studio-shell.tsx","apps/clover-launch-studio/src/components/transcript-editor.tsx","apps/clover-launch-studio/src/components/progress-timeline.tsx","apps/clover-launch-studio/src/components/decision-rail.tsx","apps/clover-launch-studio/src/components/preview-pane.tsx","apps/clover-launch-studio/src/lib/config.ts","apps/clover-launch-studio/src/lib/auth.ts","apps/clover-launch-studio/src/lib/acl.ts","apps/clover-launch-studio/src/lib/crypto.ts","apps/clover-launch-studio/src/lib/storage.ts","apps/clover-launch-studio/src/lib/launch-session-service.ts","apps/clover-launch-studio/src/lib/handoff-codex-adapter.ts","apps/clover-launch-studio/test/launch-studio-app.test.mjs","apps/clover-launch-studio/test/launch-studio-browser.test.mjs"],"approvalDoesNotAuthorizeMergeOrProduction":true,"budgetId":"session_budget_phase_b_02b_action_005_001","charterApprovalAuthorityReferenceId":"handoff-action:005:launch-studio-phase-b-source","consequentialAuthorityGranted":false,"contextPackHash":"1403c398bdc47588cb9f7208a8ef67d4126da76dcbe67823341e565ff75f943b","deliverables":["One future isolated worktree on the destination defined by the bound Executor Work Order.","One local source commit whose changed paths are an exact subset of the ordered 31-path boundary.","One future source-bound Handoff receipt with exact source, branch, base, commit, tree and preservation evidence."],"documentType":"clover-build-charter","exactTarget":"After separate exact approval, prepare one isolated local source candidate from chrisdortch/first:main@e5688c771d384d80a8c723cfa655298ce8257889; use only the destination defined by the bound Executor Work Order and future receipt contract, then stop before validation or publication.","impactScanHash":"4a31060218c09f99e980d2922ec03eb1c3fb4131adddee03a47da7dd4221452c","intendedFruit":["One source-bound local candidate ready for a separate exact validation Action.","No provider, private-data, preview, publication, merge, production or external effect."],"intendedUsers":["One owner using a future private authenticated Launch Studio application.","One read-only ChatGPT Clover context and review surface."],"nonGoals":["No workflow change, provider resource, OAuth registration, storage, ChatGPT app, Vercel preview or Gateway change.","No validation, repair, push, pull request, merge, production, private-data ingestion, real participant or workspace.","No secret, environment variable, domain, message, payment, purchase or spending."],"privacyClass":"private","progressReportingContract":["Evidence-backed material deltas only, with authenticated cursor ownership and bounded replay in a later app.","Record exact source identity, changed paths and candidate identity; never prompts, hidden reasoning or chain-of-thought."],"prohibitedEffects":["workflow-change","provider-resource-creation","oauth-registration","storage-creation","chatgpt-app-create-or-refresh","vercel-preview","gateway-change-or-promotion","private-data-ingestion","real-participant-or-workspace-creation","validation","repair","push","pull-request-publication","merge","production-deployment","message","external-message","payment","purchase","spending"],"prohibitedPaths":[".github/workflows/clover-required-main-gate.yml","apps/clover-context-gateway/**","portfolio/**","standards/**"],"recordHash":"50c4dfdb1affa7698993f257c8880f9153a5b596d5e9a676350b8754863630cd","recordId":"build_charter_phase_b_02b_action_005_001","repairLoopLimit":0,"rollbackAnchor":"Immutable Action source e5688c771d384d80a8c723cfa655298ce8257889 / 4c84129b4fb5ea098ac9d2325bc2cb387857a471; remove only a future isolated worktree and unpushed local candidate branch.","schemaVersion":"0.1.0","scope":["Create source only at exactly the ordered 31 allowed application paths.","Use the destination defined by the bound Executor Work Order as the worktree destination, never as a verified source identity.","Implement provider-neutral ports: owner-authentication, append-only-session-event-storage, content-addressed-artifact-storage, encryption-and-key-references, progress-event-delivery.","Require local and synthetic adapters sufficient for source creation without any provider account or resource.","Clerk: candidate provider, unselected","Neon: candidate provider, unselected","Vercel Blob: candidate provider, unselected","Vercel hosting: candidate provider, unprovisioned"],"sessionId":"launch_session_phase_b_02b_action_005_proposal_001","sourceAnchor":"chrisdortch/first@e5688c771d384d80a8c723cfa655298ce8257889","stopConditions":["Any protected-main, capsule, path, Work Order hash or source identity differs.","Any validation, repair, push, PR, provider, preview, private-data or external effect would occur.","Any path outside the exact 31 or any persistent configuration change is required.","Stop after the same failure signature occurs twice.","Stop after one repair loop produces no new evidence.","Maximum future repair loops remains three; Action 005 has no repair authority."],"synthetic":false,"testPlan":["accept_auth_anonymous_deny","accept_auth_clerk_validation","accept_auth_subject_binding","accept_acl_isolation","accept_event_append_only","accept_storage_encryption","accept_artifact_cas","accept_transcript_integrity","accept_transcript_successor","accept_raw_audio_false","accept_retention_deletion","accept_export_restore","accept_memory_separation","accept_chatgpt_read_only","accept_handoff_default_deny","accept_approval_noninheritance","accept_codex_boundary","accept_progress_evidence","accept_budget_structural","accept_budget_failure_stop","accept_purchase_zero","accept_local_node_matrix","accept_browser_desktop","accept_browser_mobile","accept_accessibility","accept_browser_runtime","accept_workflow_integrity","accept_privacy_authority","accept_stage_one_no_provider","accept_source_rollback"],"visualBrowserPlan":["Deferred; Action 005 carries no validation or preview authority."]}
